{"actions":["use","learn"],"activity":{"note":"Die offizielle Projektseite war am Prüftag erreichbar und beschrieb aktuelle Nutzung oder Mitwirkung.","observed_at":"2026-07-12","source_ids":["wikimedia-projects"],"status":"active"},"curation":{"catalogued_at":"2026-07-12","next_review_at":"2026-10-31","notes":"Governance-Basisreview am 30.10.2026, siehe eigenständige 5-Kriterien-Belege. Aktuelle Tätigkeit nicht unabhängig bestätigt, weiterhin stale.","reviewed_at":"2026-10-30","reviewed_by":"Commonworld editorial review","state":"stale"},"handoff":{"enabled":false},"id":"wikiversity","links":[{"label":"Wikiversity – offizielle Seite","type":"homepage","url":"https://www.wikiversity.org/"},{"label":"Wikimedia projects","type":"source","url":"https://www.wikimedia.org/"},{"label":"Wikiversity öffnen","source_ids":["wikimedia-projects"],"type":"use","url":"https://www.wikiversity.org/"},{"label":"In Wikiversity lernen","source_ids":["wikimedia-projects"],"type":"learn","url":"https://www.wikiversity.org/"}],"presence":{"digital":{"available":true,"label":"Freie Lernressourcen und gemeinschaftliche Bildungsprojekte","reach":"global","source_ids":["wikimedia-projects"]},"geographic":[]},"provenance":{"sources":[{"id":"wikimedia-projects","label":"Wikimedia projects","note":"Die offizielle Wikimedia-Übersicht führt Wikiversity als Sammlung freier Lernressourcen.","retrieved_at":"2026-07-12","type":"official-source","url":"https://www.wikimedia.org/"},{"id":"wikiversity-newcomers","label":"Wikiversity – Welcome, newcomers","note":"Offizielle Einladung zur Mitgestaltung frei verfügbarer Lehr- und Forschungsprojekte.","retrieved_at":"2026-10-30","type":"official-source","url":"https://en.wikiversity.org/wiki/Wikiversity:Welcome,_newcomers"},{"id":"wikiversity-basic-policies-de","label":"Wikiversity – grundlegende Richtlinien","note":"Lokale verbindliche Regeln zur Kollaboration und Inhaltslizenz.","retrieved_at":"2026-10-30","type":"official-source","url":"https://de.wikiversity.org/wiki/Wikiversity:Grundlegende_Richtlinien"}]},"schema_version":4,"summary":"Eine offene Plattform für freie Lernressourcen, Kurse und gemeinschaftliche Bildungsprojekte in vielen Sprachen.","themes":["learning","education"],"title":"Wikiversity"}
