{
  "schema_version": 4,
  "id": "root-access-hackerspace",
  "title": "Root Access Hackerspace",
  "summary": "Ein gemeinnütziger, vollständig ehrenamtlich betriebener Hackerspace und Makerspace in Fresno, in dem Mitglieder Werkzeuge und Infrastruktur teilen und öffentliche Kurse sowie Gemeinschaftsveranstaltungen organisieren.",
  "themes": [
    "shared-space",
    "tool-sharing",
    "skills",
    "open-hardware",
    "community-ownership"
  ],
  "actions": [
    "visit",
    "learn",
    "contribute",
    "volunteer",
    "donate",
    "contact"
  ],
  "presence": {
    "geographic": [
      {
        "id": "root-access-fresno",
        "mode": "approximate",
        "label": "Fresno, Kalifornien – grober Stadtanker",
        "geometry": {
          "type": "Point",
          "coordinates": [
            -119.7871,
            36.7378
          ]
        },
        "uncertainty_meters_min": 5000,
        "privacy_note": "Der Punkt bezeichnet Fresno nur als grobe öffentliche Orientierung; die offizielle Projektseite veröffentlicht die tatsächliche Besucheradresse.",
        "source_ids": [
          "rootaccess-home",
          "fresno-registry"
        ]
      }
    ],
    "digital": {
      "available": true,
      "reach": "network",
      "label": "Community-Wiki und Discord als laufende Ergänzung des physischen Makerspace",
      "source_ids": [
        "rootaccess-home"
      ]
    }
  },
  "activity": {
    "status": "active",
    "observed_at": "2026-07-22",
    "source_ids": [
      "rootaccess-home"
    ],
    "note": "Die offizielle Seite veröffentlichte im Juli 2026 laufende Öffnungszeiten, Community-Veranstaltungen und aktuelle Kurstermine."
  },
  "provenance": {
    "sources": [
      {
        "id": "rootaccess-home",
        "type": "official-source",
        "label": "Root Access – offizielle Seite",
        "url": "https://rootaccess.org/",
        "retrieved_at": "2026-07-22",
        "note": "Offizielle aktuelle Seite zu Trägerschaft, Raum, Werkzeugen, Mitgliedschaft, Wiki, Discord, Öffnungszeiten und Kursen."
      },
      {
        "id": "fresno-registry",
        "type": "public-registry",
        "label": "Wikidata – Fresno",
        "url": "https://www.wikidata.org/wiki/Q43301",
        "retrieved_at": "2026-07-22",
        "note": "Öffentlicher Registereintrag für die grobe Stadtzuordnung; nicht als exakte Projektadresse verwendet."
      }
    ],
    "uncertainty_note": "Die Kartenkoordinate dient nur als weiter Stadtanker; die veröffentlichte Adresse bleibt die maßgebliche Besuchsinformation."
  },
  "curation": {
    "state": "listed",
    "catalogued_at": "2026-07-22",
    "reviewed_by": "Commonworld editorial review",
    "reviewed_at": "2026-07-22",
    "next_review_at": "2026-10-22",
    "notes": "Als hybride Praxis modelliert, weil Wiki und Discord Teil der laufenden Gemeinschaftskoordination sind."
  },
  "links": [
    {
      "type": "homepage",
      "label": "Root Access – offizielle Seite",
      "url": "https://rootaccess.org/"
    },
    {
      "type": "visit",
      "label": "Root Access besuchen",
      "url": "https://rootaccess.org/",
      "source_ids": [
        "rootaccess-home"
      ]
    },
    {
      "type": "learn",
      "label": "Kurse und Gemeinschaft entdecken",
      "url": "https://rootaccess.org/classes",
      "source_ids": [
        "rootaccess-home"
      ]
    },
    {
      "type": "contribute",
      "label": "Community-Wiki nutzen",
      "url": "https://rootaccess.org/wiki/Main_Page/",
      "source_ids": [
        "rootaccess-home"
      ]
    },
    {
      "type": "volunteer",
      "label": "Gemeinschaftlich mitwirken",
      "url": "https://rootaccess.org/",
      "source_ids": [
        "rootaccess-home"
      ]
    },
    {
      "type": "donate",
      "label": "Root Access unterstützen",
      "url": "https://rootaccess.org/",
      "source_ids": [
        "rootaccess-home"
      ]
    },
    {
      "type": "contact",
      "label": "Root Access kontaktieren",
      "url": "https://rootaccess.org/",
      "source_ids": [
        "rootaccess-home"
      ]
    }
  ],
  "handoff": {
    "enabled": false
  },
  "languages": {
    "codes": [
      "en"
    ],
    "source_ids": [
      "rootaccess-home"
    ],
    "note": "Die geprüfte offizielle Hauptseite ist auf Englisch verfügbar."
  },
  "access": {
    "type": "membership",
    "source_ids": [
      "rootaccess-home"
    ],
    "note": "Reguläre Werkzeugnutzung ist mitgliedschaftsbasiert; öffentliche Kurse und Veranstaltungen ergänzen den Zugang."
  }
}
