{"access":{"note":"Informationen und Kontakt sind öffentlich; institutionelle Mitwirkung gehört zu den beteiligten Dorfgemeinschaften und ihren Regeln.","source_ids":["tbs-impact"],"type":"restricted"},"actions":["learn","contact"],"activity":{"note":"Aktuelle offizielle Seiten führen den Arvari unter den wiederbelebten Flüssen und nennen zehn etablierte Flussparlamente; eine separat datierte aktuelle Sitzung oder institutionelle Statusmeldung des Arvari-Parlaments wurde jedoch nicht gefunden.","observed_at":"2026-09-02","source_ids":["tbs-rivers","tbs-impact"],"status":"unknown"},"curation":{"catalogued_at":"2026-07-30","next_review_at":"2026-10-02","notes":"Aktueller Betriebszustand nicht zeitnah verifiziert; bei der Nachprüfung am 2026-09-02 blieb eine objektspezifische aktuelle Statusmeldung des Arvari-Parlaments offen. Identität und Wassergovernance sind offiziell belegt; priorisierte Nachprüfung bis 2026-10-02.","reviewed_at":"2026-09-02","reviewed_by":"Commonworld editorial review","state":"stale"},"handoff":{"enabled":false},"id":"arvari-river-parliament","languages":{"codes":["en"],"note":"Die geprüften offiziellen Projektseiten sind auf Englisch verfügbar.","source_ids":["tbs-rivers"]},"links":[{"label":"Arvari bei Tarun Bharat Sangh","type":"homepage","url":"https://tarunbharatsangh.in/rivers-rejuvenated/"},{"label":"Arvari und gemeinschaftliche Flusswiederbelebung kennenlernen","source_ids":["tbs-rivers"],"type":"learn","url":"https://tarunbharatsangh.in/rivers-rejuvenated/"},{"label":"Tarun Bharat Sangh zur Flussgovernance kontaktieren","source_ids":["tbs-contact"],"type":"contact","url":"https://tarunbharatsangh.in/contact/"}],"presence":{"digital":{"available":false,"source_ids":["tbs-rivers"]},"geographic":[{"geometry":{"coordinates":[76.6,27.57],"type":"Point"},"id":"arvari-alwar-district-anchor","label":"Arvari-Einzugsgebiet im Distrikt Alwar, Rajasthan – grober Distriktanker","mode":"approximate","privacy_note":"Der Punkt bezeichnet nur den öffentlichen Distriktbezug. Dörfer, Brunnen, Wasserbauten, Grundstücke und Nutzungsgrenzen werden nicht rekonstruiert.","source_ids":["tbs-rivers","alwar-wikidata"],"uncertainty_meters_min":85000},{"id":"arvari-water-infrastructure","label":"Dörfer, Wasserbauten und lokale Nutzungsorte im Einzugsgebiet","mode":"hidden","privacy_note":"Konkrete Wasserinfrastruktur und lokale Nutzungsorte werden ohne einzeln geprüfte öffentliche Geometrie nicht veröffentlicht.","source_ids":["tbs-rivers"]}]},"provenance":{"sources":[{"id":"tbs-rivers","label":"Tarun Bharat Sangh – Rivers Rejuvenated","note":"Offizielle Projektseite, die Arvari als wiederbelebten Fluss und die gemeinschaftliche Arbeit an Wasserstrukturen dokumentiert.","retrieved_at":"2026-09-02","type":"official-source","url":"https://tarunbharatsangh.in/rivers-rejuvenated/"},{"id":"tbs-impact","label":"Tarun Bharat Sangh – Impact","note":"Offizielle Wirkungsseite mit gemeinschaftlicher Verantwortung für natürliche Ressourcen und zehn etablierten Flussparlamenten.","retrieved_at":"2026-09-02","type":"official-source","url":"https://tarunbharatsangh.in/impact/"},{"id":"tbs-contact","label":"Tarun Bharat Sangh – Contact","note":"Offizieller Kontaktweg der begleitenden Wasserorganisation im Distrikt Alwar.","retrieved_at":"2026-07-30","type":"official-source","url":"https://tarunbharatsangh.in/contact/"},{"id":"alwar-wikidata","label":"Wikidata – Alwar district","note":"CC0-Registereintrag für den groben Distriktanker; keine Aussage über einzelne Dörfer oder Wasseranlagen.","retrieved_at":"2026-07-30","type":"public-registry","url":"https://www.wikidata.org/wiki/Q449690"}],"uncertainty_note":"Die Commons-Identität ist die gemeinschaftliche Flussinstitution, nicht Tarun Bharat Sangh. Die Geometrie ist nur ein Distriktanker und keine Darstellung des Einzugsgebiets."},"schema_version":4,"summary":"Eine aus Dorfgemeinschaften im Einzugsgebiet des Arvari-Flusses hervorgegangene Wasserinstitution, die gemeinsame Regeln, Verantwortung und Konfliktbearbeitung für die Wiederbelebung und Nutzung des Flusses organisiert.","themes":["water","commons-governance","watershed","restoration","community-land","climate-resilience"],"title":"Arvari River Parliament"}
