{"actions":["visit","learn","contact"],"activity":{"note":"Die offizielle Projektseite beschreibt Le Nid als bewohntes CLTB-Pilotprojekt mit gemeinschaftlich verwalteten Räumen.","observed_at":"2026-07-15","source_ids":["cltb-le-nid-official"],"status":"active"},"curation":{"catalogued_at":"2026-07-15","next_review_at":"2026-10-15","notes":"Identität, öffentlicher Adresseinstieg und Gebäudefläche wurden zwischen offizieller Projektseite und öffentlichem Register abgeglichen; benachbarte Flächen wurden nicht zugerechnet.","reviewed_at":"2026-07-15","reviewed_by":"Commonworld editorial review","state":"listed"},"handoff":{"enabled":false},"id":"cltb-le-nid","links":[{"label":"Le Nid – offizielle Projektseite","type":"homepage","url":"https://cltb.be/en/projet/verheyden-le-nid-2/"},{"label":"Gebäudefläche in OpenStreetMap","type":"source","url":"https://www.openstreetmap.org/way/260066697"},{"label":"Öffentlicher Standort in OpenStreetMap","source_ids":["osm-le-nid-address"],"type":"visit","url":"https://www.openstreetmap.org/node/13966522352"},{"label":"Le Nid kennenlernen","source_ids":["cltb-le-nid-official"],"type":"learn","url":"https://cltb.be/en/projet/verheyden-le-nid-2/"},{"label":"Community Land Trust Brussels kontaktieren","source_ids":["cltb-le-nid-official"],"type":"contact","url":"https://cltb.be/contact/"}],"presence":{"digital":{"available":false,"source_ids":["cltb-le-nid-official"]},"geographic":[{"geometry":{"coordinates":[4.3152961,50.8452417],"type":"Point"},"id":"cltb-le-nid-entrance","label":"Rue Verheyden 121, Anderlecht","mode":"exact","source_ids":["cltb-le-nid-official","osm-le-nid-address"]},{"geometry":{"coordinates":[[[4.31523,50.845402],[4.3152518,50.8453879],[4.3153147,50.8453469],[4.3154309,50.8452714],[4.3152259,50.8451475],[4.3151432,50.8452012],[4.3150783,50.8452433],[4.3151554,50.845292],[4.3151046,50.8453244],[4.31523,50.845402]]],"type":"Polygon"},"id":"cltb-le-nid-building","label":"Gebäude Le Nid","mode":"exact","source_ids":["cltb-le-nid-official","osm-le-nid-building"]}]},"provenance":{"sources":[{"id":"cltb-le-nid-official","label":"Community Land Trust Brussels – Verheyden / Le Nid","note":"Offizielle Projektseite mit Adresse, sieben Wohnungen, Gemeinschaftsraum, Garten und gemeinschaftlicher Verwaltung.","retrieved_at":"2026-07-15","type":"official-source","url":"https://cltb.be/en/projet/verheyden-le-nid-2/"},{"id":"osm-le-nid-address","label":"OpenStreetMap – Rue Verheyden 121","note":"Öffentlicher Registerpunkt für die auf der offiziellen Projektseite genannte Adresse; OpenStreetMap-Daten unter ODbL 1.0.","retrieved_at":"2026-07-15","type":"public-registry","url":"https://www.openstreetmap.org/node/13966522352"},{"id":"osm-le-nid-building","label":"OpenStreetMap – Gebäude Le Nid","note":"Benannte Gebäudefläche Le Nid mit sieben Wohnungen; OpenStreetMap-Daten unter ODbL 1.0.","retrieved_at":"2026-07-15","type":"public-registry","url":"https://www.openstreetmap.org/way/260066697"}]},"relations":[],"schema_version":4,"summary":"Ein Wohnprojekt des Community Land Trust Brussels mit sieben Wohnungen, einem Gemeinschaftsraum und einem halböffentlichen Garten in Anderlecht.","themes":["housing","community-land","shared-space"],"title":"Le Nid"}
