{"actions":["use","learn","contribute","replicate"],"activity":{"note":"Die offiziellen Seiten dokumentieren ein aktives, freiwillig getragenes Projekt, aktuelle Einstiegspfade und laufende öffentliche Entwicklung.","observed_at":"2026-07-31","source_ids":["meshtastic-home","meshtastic-introduction","meshtastic-firmware"],"status":"active"},"curation":{"catalogued_at":"2026-07-31","next_review_at":"2026-10-31","notes":"Als digitale Commons-Infrastruktur aufgenommen. Katalogisiert ist das gemeinschaftlich entwickelte offene Ökosystem; einzelne private Meshes gelten nicht automatisch als eigenständige Commons.","reviewed_at":"2026-07-31","reviewed_by":"Commonworld editorial review","state":"listed"},"handoff":{"enabled":false},"id":"meshtastic","languages":{"codes":["en"],"note":"Die geprüften globalen Hauptoberflächen und Dokumentationen sind auf Englisch verfügbar.","source_ids":["meshtastic-home"]},"links":[{"label":"Meshtastic – offizielle Seite","type":"homepage","url":"https://meshtastic.org/"},{"label":"Meshtastic einrichten und nutzen","source_ids":["meshtastic-getting-started"],"type":"use","url":"https://meshtastic.org/docs/getting-started/"},{"label":"Projekt und Funktionsweise kennenlernen","source_ids":["meshtastic-introduction"],"type":"learn","url":"https://meshtastic.org/docs/introduction/"},{"label":"Zur Entwicklung beitragen","source_ids":["meshtastic-firmware"],"type":"contribute","url":"https://github.com/meshtastic/firmware"},{"label":"Ein eigenes Mesh aufbauen","source_ids":["meshtastic-getting-started"],"type":"replicate","url":"https://meshtastic.org/docs/getting-started/"},{"label":"Firmware-Lizenz und Quellcode","source_ids":["meshtastic-firmware"],"type":"license","url":"https://github.com/meshtastic/firmware"}],"presence":{"digital":{"available":true,"label":"Offene Mesh-Firmware, Protokolle, Dokumentation und weltweite Community-Zusammenarbeit","reach":"global","source_ids":["meshtastic-home","meshtastic-introduction","meshtastic-firmware"]},"geographic":[]},"provenance":{"sources":[{"id":"meshtastic-home","label":"Meshtastic – offizielle Seite","note":"Offizielle Selbstbeschreibung als quelloffenes, dezentrales Off-grid-Mesh-Netz.","retrieved_at":"2026-07-31","type":"official-source","url":"https://meshtastic.org/"},{"id":"meshtastic-introduction","label":"Meshtastic – Introduction","note":"Offizielle Beschreibung der gemeinschaftsgetragenen Entwicklung, Wartung und Beteiligungswege.","retrieved_at":"2026-07-31","type":"official-source","url":"https://meshtastic.org/docs/introduction/"},{"id":"meshtastic-getting-started","label":"Meshtastic – Getting started","note":"Offizieller Einstieg in Nutzung und selbst betriebenes Mesh.","retrieved_at":"2026-07-31","type":"official-source","url":"https://meshtastic.org/docs/getting-started/"},{"id":"meshtastic-firmware","label":"Meshtastic Firmware – offizielles Repository","note":"Öffentliche Firmware-Entwicklung mit GPL-3.0-Lizenz, Beitragsregeln und Verhaltenskodex.","retrieved_at":"2026-07-31","type":"official-source","url":"https://github.com/meshtastic/firmware"},{"id":"meshtastic-legal","label":"Meshtastic – Legal","note":"Offizielle Angaben zu Open-Source-Verpflichtung, Marke und dem getrennten kommerziellen Unternehmen Meshtastic Solutions.","retrieved_at":"2026-07-31","type":"official-source","url":"https://meshtastic.org/docs/legal/"}],"uncertainty_note":"Strategische und markenrechtliche Kontrolle ist teilweise bei Kernbeitragenden beziehungsweise Organisationen konzentriert; dies wird nicht mit gemeinschaftlicher Vollkontrolle gleichgesetzt."},"schema_version":4,"summary":"Ein gemeinschaftlich entwickeltes Open-Source-Ökosystem für dezentrale Off-grid-Kommunikation über günstige, stromsparende LoRa-Geräte mit gemeinsam gepflegter Firmware, Protokollen, Dokumentation und Beteiligungswegen.","themes":["community-network","communication","open-source","infrastructure","open-hardware"],"title":"Meshtastic"}
