{"actions":["learn","use"],"activity":{"note":"Die offizielle Genossenschaftsseite beschreibt den gegenwärtigen mitgliedereigenen Betrieb und die Weiterentwicklung des lokalen Energiesystems.","observed_at":"2026-07-19","source_ids":["source-hepburn-official"],"status":"active"},"curation":{"catalogued_at":"2026-07-19","next_review_at":"2026-10-19","notes":"Aufgenommen als belegte gemeinschaftliche Praxis mit eigenständigem Beitrag zur thematischen und regionalen Katalogbalance.","reviewed_at":"2026-07-19","reviewed_by":"Commonworld editorial review","state":"stale"},"handoff":{"enabled":false},"id":"hepburn-energy","links":[{"label":"Hepburn Energy – offizielle Quelle","type":"homepage","url":"https://www.hepburnenergy.coop/about/"},{"label":"Genossenschaft kennenlernen","source_ids":["source-hepburn-official"],"type":"learn","url":"https://www.hepburnenergy.coop/about/"},{"label":"Mitgliederportal und Mitgliedschaft nutzen","source_ids":["source-hepburn-membership"],"type":"use","url":"https://www.hepburnenergy.coop/membership/"}],"presence":{"digital":{"available":true,"label":"Mitgliederportal für Mitgliedschaft und Genossenschaftsanteile","reach":"regional","source_ids":["source-hepburn-membership"]},"geographic":[{"geometry":{"coordinates":[144.15,-37.35],"type":"Point"},"id":"hepburn-energy-approximate-area","label":"Hepburn Shire, Victoria, Australien","mode":"approximate","privacy_note":"Der Punkt bezeichnet den groben, öffentlich registrierten Ortsbezug Daylesford und nicht einzelne Anlagen oder Grundstücke.","source_ids":["source-hepburn-official","source-daylesford-wikidata"],"uncertainty_meters_min":25000}]},"provenance":{"sources":[{"id":"source-hepburn-official","label":"About — Hepburn Energy","note":"Offizielle Projektquelle für Beschreibung, Aktivität und den verknüpften direkten Zugang.","retrieved_at":"2026-07-19","type":"official-source","url":"https://www.hepburnenergy.coop/about/"},{"id":"source-daylesford-wikidata","label":"Daylesford","note":"CC0-Registereintrag für den groben öffentlich belegten Ortsbezug; nur zur ungefähren Orientierung verwendet.","retrieved_at":"2026-07-19","type":"public-registry","url":"https://www.wikidata.org/wiki/Q3019340"},{"id":"source-hepburn-membership","label":"Membership — Hepburn Energy","note":"Offizieller digitaler Mitgliedschaftsweg mit Zugang zum Mitgliederportal und Verwaltung von Mitgliedschaft und Genossenschaftsanteilen.","retrieved_at":"2026-07-19","type":"official-source","url":"https://www.hepburnenergy.coop/membership/"}],"uncertainty_note":"Die Punktgeometrie ist nur eine grobe Orientierung für den öffentlich belegten Wirkungsraum und keine exakte Standort- oder Flächenangabe."},"schema_version":4,"summary":"Eine mitgliedereigene Energiegenossenschaft im australischen Hepburn Shire, die gemeinschaftlich Windenergie betreibt und ihre lokale Erzeugung weiterentwickelt.","themes":["energy","renewable-energy","community-ownership","cooperative","energy-democracy"],"title":"Hepburn Energy"}
